{
  "$schema": "https://json-schema.org/draft/2020-12/schema",
  "$id": "https://github.com/koreagorani/macro-monitor/blob/main/data/schema/portfolio-vulnerability-output.schema.json",
  "title": "Portfolio Vulnerability Output",
  "type": "object",
  "additionalProperties": false,
  "required": [
    "schemaVersion",
    "asOf",
    "sourceRisk",
    "selection",
    "themeVulnerabilities",
    "warnings"
  ],
  "properties": {
    "schemaVersion": { "type": "string", "const": "1.0.0" },
    "asOf": { "type": "string", "format": "date" },
    "sourceRisk": { "$ref": "#/$defs/sourceRisk" },
    "selection": { "$ref": "#/$defs/selection" },
    "themeVulnerabilities": {
      "type": "array",
      "items": { "$ref": "#/$defs/themeVulnerability" }
    },
    "warnings": {
      "type": "array",
      "items": { "$ref": "#/$defs/warning" }
    }
  },
  "$defs": {
    "sourceRisk": {
      "type": "object",
      "additionalProperties": false,
      "required": [
        "overallLevel",
        "overallScore",
        "confidence",
        "triggeredRules"
      ],
      "properties": {
        "overallLevel": {
          "type": ["string", "null"],
          "enum": ["normal", "watch", "alert", "high_risk", null]
        },
        "overallScore": { "type": ["number", "null"] },
        "confidence": { "type": "string", "enum": ["normal", "reduced", "aborted"] },
        "triggeredRules": {
          "type": "array",
          "items": { "type": "string" }
        }
      }
    },
    "selection": {
      "type": "object",
      "additionalProperties": false,
      "required": [
        "policy",
        "displayedThemeCount",
        "evaluatedThemeCount"
      ],
      "properties": {
        "policy": { "type": "string" },
        "displayedThemeCount": { "type": "integer", "minimum": 0 },
        "evaluatedThemeCount": { "type": "integer", "minimum": 0 }
      }
    },
    "themeVulnerability": {
      "type": "object",
      "additionalProperties": false,
      "required": [
        "themeId",
        "name",
        "description",
        "score",
        "level",
        "macroContributions",
        "reasons",
        "confidence",
        "hedgeCandidateIds"
      ],
      "properties": {
        "themeId": { "type": "string" },
        "name": { "type": "string" },
        "description": { "type": "string" },
        "score": { "type": "number" },
        "level": {
          "type": "string",
          "enum": ["easing", "normal", "watch", "alert", "high_risk"]
        },
        "macroContributions": {
          "type": "array",
          "items": { "$ref": "#/$defs/macroContribution" }
        },
        "reasons": {
          "type": "array",
          "items": { "type": "string", "minLength": 1 }
        },
        "confidence": { "type": "string", "enum": ["normal", "reduced", "aborted"] },
        "hedgeCandidateIds": {
          "type": "array",
          "items": { "type": "string" }
        }
      }
    },
    "macroContribution": {
      "type": "object",
      "additionalProperties": false,
      "required": [
        "areaId",
        "areaScore",
        "areaStatus",
        "exposure",
        "contribution"
      ],
      "properties": {
        "areaId": { "type": "string" },
        "areaScore": { "type": "number" },
        "areaStatus": { "type": "string" },
        "exposure": { "type": "number" },
        "contribution": { "type": "number" }
      }
    },
    "warning": {
      "type": "object",
      "additionalProperties": false,
      "required": ["code", "message", "themeId"],
      "properties": {
        "code": { "type": "string", "minLength": 1 },
        "message": { "type": "string", "minLength": 1 },
        "themeId": { "type": ["string", "null"] }
      }
    }
  }
}
