{
  "schemaVersion": "1.0.0",
  "asOf": "2026-07-05",
  "sourceRisk": {
    "overallLevel": "high_risk",
    "overallScore": 0.5473214285714287,
    "confidence": "normal",
    "triggeredRules": [
      "HIGH_RISK_RATES_INFLATION_RISK_APPETITE_WORSENING"
    ]
  },
  "selection": {
    "policy": "top_3_by_score",
    "displayedThemeCount": 3,
    "evaluatedThemeCount": 6
  },
  "themeVulnerabilities": [
    {
      "themeId": "crypto_altcoins",
      "name": "알트코인",
      "description": "비트코인을 제외한 고변동성 암호자산 테마",
      "score": 1.9803571428571427,
      "level": "alert",
      "macroContributions": [
        {
          "areaId": "rates_policy",
          "areaScore": 0.625,
          "areaStatus": "watch",
          "exposure": 1.5,
          "contribution": 0.9375
        },
        {
          "areaId": "inflation_supply",
          "areaScore": 0.7142857142857143,
          "areaStatus": "watch",
          "exposure": 0.2,
          "contribution": 0.14285714285714288
        },
        {
          "areaId": "risk_appetite",
          "areaScore": 0.5,
          "areaStatus": "watch",
          "exposure": 1.8,
          "contribution": 0.9
        },
        {
          "areaId": "dollar_korea",
          "areaScore": 0,
          "areaStatus": "normal",
          "exposure": 0.4,
          "contribution": 0
        }
      ],
      "reasons": [
        "rates_policy 영역 위험 점수와 알트코인 테마 민감도가 취약도에 기여했습니다.",
        "risk_appetite 영역 위험 점수와 알트코인 테마 민감도가 취약도에 기여했습니다."
      ],
      "confidence": "normal",
      "hedgeCandidateIds": [
        "cash_krw",
        "short_duration_bonds"
      ]
    },
    {
      "themeId": "us_large_cap_growth",
      "name": "미국 대형 성장주",
      "description": "미국 대형 기술주와 성장주 중심 테마",
      "score": 1.3392857142857144,
      "level": "watch",
      "macroContributions": [
        {
          "areaId": "rates_policy",
          "areaScore": 0.625,
          "areaStatus": "watch",
          "exposure": 1,
          "contribution": 0.625
        },
        {
          "areaId": "inflation_supply",
          "areaScore": 0.7142857142857143,
          "areaStatus": "watch",
          "exposure": 0.3,
          "contribution": 0.21428571428571427
        },
        {
          "areaId": "risk_appetite",
          "areaScore": 0.5,
          "areaStatus": "watch",
          "exposure": 1,
          "contribution": 0.5
        },
        {
          "areaId": "dollar_korea",
          "areaScore": 0,
          "areaStatus": "normal",
          "exposure": 0.1,
          "contribution": 0
        }
      ],
      "reasons": [
        "rates_policy 영역 위험 점수와 미국 대형 성장주 테마 민감도가 취약도에 기여했습니다.",
        "risk_appetite 영역 위험 점수와 미국 대형 성장주 테마 민감도가 취약도에 기여했습니다."
      ],
      "confidence": "normal",
      "hedgeCandidateIds": [
        "cash_krw",
        "short_duration_bonds",
        "value_defensive_equity"
      ]
    },
    {
      "themeId": "long_duration_bonds",
      "name": "장기채",
      "description": "장기 듀레이션 채권 및 장기채 ETF 테마",
      "score": 1.275,
      "level": "watch",
      "macroContributions": [
        {
          "areaId": "rates_policy",
          "areaScore": 0.625,
          "areaStatus": "watch",
          "exposure": 1.4,
          "contribution": 0.875
        },
        {
          "areaId": "inflation_supply",
          "areaScore": 0.7142857142857143,
          "areaStatus": "watch",
          "exposure": 0.7,
          "contribution": 0.5
        },
        {
          "areaId": "risk_appetite",
          "areaScore": 0.5,
          "areaStatus": "watch",
          "exposure": -0.2,
          "contribution": -0.1
        },
        {
          "areaId": "dollar_korea",
          "areaScore": 0,
          "areaStatus": "normal",
          "exposure": 0.3,
          "contribution": 0
        }
      ],
      "reasons": [
        "rates_policy 영역 위험 점수와 장기채 테마 민감도가 취약도에 기여했습니다.",
        "inflation_supply 영역 위험 점수와 장기채 테마 민감도가 취약도에 기여했습니다."
      ],
      "confidence": "normal",
      "hedgeCandidateIds": [
        "cash_krw",
        "short_duration_bonds"
      ]
    }
  ],
  "warnings": []
}
